ID,Author,Quotes
227,Zig Ziglar Raising Positive Kids in a Negative World,"Of course motivation is not permanent. But then, neither is bathing; but it is something you should do on a regular basis"
228,Walt Disney,The way to get started is to quit talking and begin doing
229,Roy T. Bennett The Light in the Heart,Believe in your infinite potential. Your only limitations are those you set upon yourself
230,Jordan Belfort,The only thing standing between you and your goal is the bullshit story you keep telling yourself as to why you can't achieve it
231,Roy T. Bennett The Light in the Heart,Be Brave and Take Risks: You need to have faith in yourself. Be brave and take risks. You don't have to have it all figured out to move forward
232,Roy T. Bennett The Light in the Heart,"Surround yourself with people who believe in your dreams, encourage your ideas, support your ambitions, and bring out the best in you"
233,Roy T. Bennett The Light in the Heart,"Do what you love, love what you do, and with all your heart give yourself to it"
234,Babe Ruth,It’s hard to beat a person who never gives up
235, Leah Busque,"I wake up every morning and think to myself, ‘how far can I push this company in the next 24 hours"
236,Michele Ruiz,"If people are doubting how far you can go, go so far that you can’t hear them anymore"
237,Arianna Huffington,"We need to accept that we won’t always make the right decisions, that we’ll screw up royally sometimes – understanding that failure is not the opposite of success, it’s part of success"
238,Joss Whedon,"Write it. Shoot it. Publish it. Crochet it, sauté it, whatever. MAKE"
239,William W. Purkey,"You’ve gotta dance like there’s nobody watching, love like you’ll never be hurt, sing like there’s nobody listening, and live like it’s heaven on earth"
240,Neil Gaiman,"Fairy tales are more than true: not because they tell us that dragons exist, but because they tell us that dragons can be beaten"
241,Pablo Picasso,Everything you can imagine is real
242,Helen Keller,"When one door of happiness closes, another opens; but often we look so long at the closed door that we do not see the one which has been opened for us"
243,Eleanor Roosevelt,Do one thing every day that scares you
244,Lewis Carroll,"It’s no use going back to yesterday, because I was a different person then"
245,Socrates,"Smart people learn from everything and everyone, average people from their experiences, stupid people already have all the answers"
246,Eleanor Roosevelt,Do what you feel in your heart to be right – for you’ll be criticized anyway
247,Dalai Lama XIV,Happiness is not something ready made. It comes from your own actions
248,Abraham Lincoln,"Whatever you are, be a good one"
249,Unknown,The same boiling water that softens the potato hardens the egg. It’s what you’re made of. Not the circumstances
250,Catherine Pulsifier,If we have the attitude that it’s going to be a great day it usually is
251,Unknown,You can either experience the pain of discipline or the pain of regret. The choice is yours
252,Paulo Coelho,“Impossible is just an opinion
253,Isabelle Lafleche,Your passion is waiting for your courage to catch up
254,Johann Wolfgang Von Goethe,"Magic is believing in yourself. If you can make that happen, you can make anything happen"
255,Elon Musk,"If something is important enough, even if the odds are stacked against you, you should still do it"
256,Unknown,"Hold the vision, trust the process"
257,John D. Rockefeller,Don’t be afraid to give up the good to go for the great
258,Unknown,People who wonder if the glass is half empty or full miss the point. The glass is refillable
259,Jaymin Shah,"No one is to blame for your future situation but yourself. If you want to be successful, then become Successful"
260,Vincent Van Gogh,"If you hear a voice within you say ‘you cannot paint,’ then by all means paint and that voice will be silenced"
261,Aly Raisman,The hard days are what make you stronger
262,Wayne Dyer,"If you believe it’ll work out, you’ll see opportunities. If you don’t believe it’ll work out, you’ll see obstacles"
263,Shonda Rhimes,You can waste your lives drawing lines. Or you can live your life crossing them
264, George Lorimer,You’ve got to get up every morning with determination if you’re going to go to bed with satisfaction
265,Michelle Obama,I now tried a new hypothesis: It was possible that I was more in charge of my happiness than I was allowing myself to be
266,Mahatma Gandhi,"In a gentle way, you can shake the world"
267,Kurt Cobain,"If opportunity doesn’t knock, build a door"
268,Roy T. Bennett,Don’t be pushed around by the fears in your mind. Be led by the dreams in your heart
269,Frank Ocean,"Work hard in silence, let your success be the noise."
270,H. Jackson Brown Jr.,"Don’t say you don’t have enough time. You have exactly the same number of hours per day that were given to Helen Keller, Pasteur, Michelangelo, Mother Teresa, Leonardo Da Vinci, Thomas Jefferson, and Albert Einstein"
271,Tim Notke,Hard work beats talent when talent doesn’t work hard
272,Mario Andretti,"If everything seems to be under control, you’re not going fast enough"
273,Jimmy Johnson,The only difference between ordinary and extraordinary is that little extra
274,Oscar Wilde,The best way to appreciate your job is to imagine yourself without one
275,Benjamin Hardy,Unsuccessful people make their decisions based on their current situations. Successful people make their decisions based on where they want to be
276,Kamari aka Lyrikal,Never stop doing your best just because someone doesn’t give you credit
277,Leah LaBelle,"Work hard for what you want because it won’t come to you without a fight. You have to be strong and courageous and know that you can do anything you put your mind to. If somebody puts you down or criticizes you, just keep on believing in yourself and turn it into something positive"
278,Conan O’Brien,"Work hard, be kind, and amazing things will happen"
279,Albert Einstein,In the middle of every difficulty lies opportunity
280,Unknown,"Don’t quit yet, the worst moments are usually followed by the most beautiful silver linings. You have to stay strong, remember to keep your head up and remain hopeful"
281,John F Kennedy,When written in Chinese the word “crisis” is composed of two characters – one represents danger and the other represents opportunity
282,John C. Maxwell,Dreams don’t work unless you do
283,Dr. Wayne D. Dyer,Go the extra mile. It’s never crowded there
284,Walt Whitman,Keep your face always toward the sunshine – and shadows will fall behind you
285,Lionel from Maid in Manhattan Movie,What defines us is how well we rise after falling
286,Unknown,H.O.P.E. = Hold On. Pain Ends
287,John Wooden,Make each day your masterpiece
288,Confucius,"Wherever you go, go with all your heart"
289,Oprah,Turn your wounds into wisdom
290,Helen Keller,We can do anything we want to if we stick to it long enough
291,John Cage,Begin anywhere
292,Katharine Hepburn,"If you obey all the rules, you miss all the fun"
293,Herb Brooks,You were born to be a player. You were meant to be here. This moment is yours
294,Frank Herbert, must not fear. Fear is the mind-killer. Fear is the little-death that brings total obliteration. I will face my fear. I will permit it to pass over me and through me. And when it has gone past I will turn the inner eye to see its path. Where the fear has gone there will be nothing. Only I will remain
295,Roy T. Bennett,Attitude is a choice. Happiness is a choice. Optimism is a choice. Kindness is a choice. Giving is a choice. Respect is a choice. Whatever choice you make makes you. Choose wisely
296,Roy T. Bennett,Don't be pushed around by the fears in your mind. Be led by the dreams in your heart
297,Roy T. Bennett,Live the Life of Your Dreams: Be brave enough to live the life of your dreams according to your vision and purpose instead of the expectations and opinions of others
298,Roy T. Bennett,"Believe in yourself. You are braver than you think, more talented than you know, and capable of more than you imagine"
299,Roy T. Bennett,"s only after youâve stepped outside your comfort zone that you begin to change, grow, and transform"
300,Steve Maraboli,"The truth is, unless you let go, unless you forgive yourself, unless you forgive the situation, unless you realize that the situation is over, you cannot move forward"
301,Roy T. Bennett,"Do what is right, not what is easy nor what is popular"
302,Steve Maraboli,Dare to Be
303,Roy T. Bennett,"Success is not how high you have climbed, but how you make a positive difference to the world"
304,Roy T. Bennett,Be grateful for what you already have while you pursue your goals
305,Steve Maraboli,"Letting go means to come to the realization that some people are a part of your history, but not a part of your destiny"
306,Viktor E. Frankl,"Everything can be taken from a man but one thing: the last of the human freedoms to choose one's attitude in any given set of circumstances, to choose one's own way"
307,Zig Ziglar,"Lack of direction, not lack of time, is the problem. We all have twenty-four hour days"
308,Steve Maraboli,Cry. Forgive. Learn. Move on. Let your tears water the seeds of your future happiness
309,Steve Maraboli,Incredible change happens in your life when you decide to take control of what you do have power over instead of craving control over what you don't
310,Steve Maraboli,"Happiness is not the absence of problems, it's the ability to deal with them"
311,Confucius,The man who moves a mountain begins by carrying away small stones
312,Arthur C. Clarke,The only way of discovering the limits of the possible is to venture a little way past them into the impossible
313,Roy T. Bennett,Surround Yourself with People Who Believe in Your Dreams
